{
  "schema_version": "carnet.brand_batch_comparison/1",
  "brand": "Toyota",
  "batch_id": "toyota-batch-02",
  "read_only": true,
  "note": "CURRENT_CARNET is read through catalog_audit_readonly.py + model_boundaries.py; nothing under assets/ or lib/ is written. NEW_VERIFIED holds only values whose supporting source content was preserved (FULL_TEXT_VERIFIED / PDF_VERIFIED) and whose quote was found in it; tier 1-3 values backed only by snippets or unvalidated retrievals are NEW_NEEDS_SOURCE_RETRIEVAL, tier 4-5 values NEW_PROVISIONAL_ONLY. ONLY_IN_CARNET means 'not verified by the research collected so far', NOT 'wrong'. UNKNOWN_NOT_YET_RESEARCHED marks dimensions with no evidence at all. Vocabulary is LOCKED (rules/normalization_rules.json); 'legacy_view' blocks are informational only.",
  "models": [
    {
      "brand": "Toyota",
      "model": "GR Corolla",
      "current_carnet_meta": {
        "in_car_catalog_models": true,
        "dataset_family_rows": 0,
        "boundary": {
          "algorithm": "model_boundaries.py (rules/model_boundaries.json)",
          "legacy_family_rows": 0,
          "strict_rows": 0,
          "excluded_rows": 0,
          "excluded_by_reason": {},
          "excluded_examples": {},
          "accepted_by_status": {},
          "accepted_with_flags": []
        },
        "petrol_rows_whose_dataset_name_says_hybrid": 0,
        "dataset_model_names": [],
        "dataset_year_span": null
      },
      "dimensions": {
        "trims": {
          "carnet_stores_field": true,
          "CURRENT_CARNET": [
            "Circuit",
            "Core",
            "Morizo",
            "Premium",
            "Special Edition"
          ],
          "NEW_VERIFIED": [
            "Circuit Edition",
            "Core",
            "GTS",
            "MORIZO Edition",
            "Premium",
            "Premium Plus"
          ],
          "NEW_PROVISIONAL_ONLY": [],
          "NEW_NEEDS_SOURCE_RETRIEVAL": [],
          "MATCHED": [
            "Core",
            "Premium"
          ],
          "MISSING_FROM_CARNET": [
            "Circuit Edition",
            "GTS",
            "MORIZO Edition",
            "Premium Plus"
          ],
          "PROVISIONAL_NOT_IN_CARNET": [],
          "NEEDS_SOURCE_RETRIEVAL_NOT_IN_CARNET": [],
          "CARNET_VALUE_ONLY_PROVISIONAL": [],
          "CARNET_VALUE_ONLY_NEEDS_SOURCE_RETRIEVAL": [],
          "ONLY_IN_CARNET": [
            {
              "value": "Circuit",
              "dataset_rows": 1
            },
            {
              "value": "Morizo",
              "dataset_rows": 1
            },
            {
              "value": "Special Edition",
              "dataset_rows": 1
            }
          ],
          "CONFLICTS": [],
          "research_coverage": "GOOD",
          "UNKNOWN_NOT_YET_RESEARCHED": false
        },
        "engine_sizes": {
          "carnet_stores_field": true,
          "CURRENT_CARNET": [],
          "NEW_VERIFIED": [
            "1.6L"
          ],
          "NEW_PROVISIONAL_ONLY": [],
          "NEW_NEEDS_SOURCE_RETRIEVAL": [],
          "MATCHED": [],
          "MISSING_FROM_CARNET": [
            "1.6L"
          ],
          "PROVISIONAL_NOT_IN_CARNET": [],
          "NEEDS_SOURCE_RETRIEVAL_NOT_IN_CARNET": [],
          "CARNET_VALUE_ONLY_PROVISIONAL": [],
          "CARNET_VALUE_ONLY_NEEDS_SOURCE_RETRIEVAL": [],
          "ONLY_IN_CARNET": [],
          "CONFLICTS": [],
          "research_coverage": "GOOD",
          "UNKNOWN_NOT_YET_RESEARCHED": false
        },
        "cylinders": {
          "carnet_stores_field": true,
          "CURRENT_CARNET": [],
          "NEW_VERIFIED": [
            3
          ],
          "NEW_PROVISIONAL_ONLY": [],
          "NEW_NEEDS_SOURCE_RETRIEVAL": [],
          "MATCHED": [],
          "MISSING_FROM_CARNET": [
            3
          ],
          "PROVISIONAL_NOT_IN_CARNET": [],
          "NEEDS_SOURCE_RETRIEVAL_NOT_IN_CARNET": [],
          "CARNET_VALUE_ONLY_PROVISIONAL": [],
          "CARNET_VALUE_ONLY_NEEDS_SOURCE_RETRIEVAL": [],
          "ONLY_IN_CARNET": [],
          "CONFLICTS": [],
          "research_coverage": "GOOD",
          "UNKNOWN_NOT_YET_RESEARCHED": false
        },
        "fuel_types": {
          "carnet_stores_field": true,
          "CURRENT_CARNET": [],
          "NEW_VERIFIED": [],
          "NEW_PROVISIONAL_ONLY": [],
          "NEW_NEEDS_SOURCE_RETRIEVAL": [
            "Petrol"
          ],
          "MATCHED": [],
          "MISSING_FROM_CARNET": [],
          "PROVISIONAL_NOT_IN_CARNET": [],
          "NEEDS_SOURCE_RETRIEVAL_NOT_IN_CARNET": [
            "Petrol"
          ],
          "CARNET_VALUE_ONLY_PROVISIONAL": [],
          "CARNET_VALUE_ONLY_NEEDS_SOURCE_RETRIEVAL": [],
          "ONLY_IN_CARNET": [],
          "CONFLICTS": [],
          "legacy_view": {
            "reason": "legacy dataset stores every hybrid as 'Petrol (Gasoline)'",
            "mapping": {
              "Hybrid": "Petrol",
              "Plug-in Hybrid": "Petrol"
            },
            "MISSING_FROM_CARNET": []
          },
          "research_coverage": "PARTIAL",
          "UNKNOWN_NOT_YET_RESEARCHED": false
        },
        "transmissions": {
          "carnet_stores_field": true,
          "CURRENT_CARNET": [],
          "NEW_VERIFIED": [
            "Automatic",
            "Manual"
          ],
          "NEW_PROVISIONAL_ONLY": [],
          "NEW_NEEDS_SOURCE_RETRIEVAL": [],
          "MATCHED": [],
          "MISSING_FROM_CARNET": [
            "Automatic",
            "Manual"
          ],
          "PROVISIONAL_NOT_IN_CARNET": [],
          "NEEDS_SOURCE_RETRIEVAL_NOT_IN_CARNET": [],
          "CARNET_VALUE_ONLY_PROVISIONAL": [],
          "CARNET_VALUE_ONLY_NEEDS_SOURCE_RETRIEVAL": [],
          "ONLY_IN_CARNET": [],
          "CONFLICTS": [
            {
              "conflict_id": "CF-toyota-gr_corolla-001",
              "field": "transmission_family",
              "engine_group": "model_level",
              "severity": "definite",
              "values": [
                [
                  "GRC-004",
                  "Manual"
                ],
                [
                  "GRC-005",
                  "Automatic"
                ]
              ]
            },
            {
              "conflict_id": "CF-toyota-gr_corolla-002",
              "field": "transmission_family",
              "engine_group": "model_level",
              "severity": "definite",
              "values": [
                [
                  "GRC-016",
                  "Manual"
                ],
                [
                  "GRC-017",
                  "Automatic"
                ]
              ]
            }
          ],
          "research_coverage": "CONFLICT",
          "UNKNOWN_NOT_YET_RESEARCHED": false
        },
        "transmission_variants": {
          "carnet_stores_field": false,
          "CURRENT_CARNET": [],
          "NEW_VERIFIED": [],
          "NEW_PROVISIONAL_ONLY": [],
          "NEW_NEEDS_SOURCE_RETRIEVAL": [],
          "MATCHED": [],
          "MISSING_FROM_CARNET": [],
          "PROVISIONAL_NOT_IN_CARNET": [],
          "NEEDS_SOURCE_RETRIEVAL_NOT_IN_CARNET": [],
          "CARNET_VALUE_ONLY_PROVISIONAL": [],
          "CARNET_VALUE_ONLY_NEEDS_SOURCE_RETRIEVAL": [],
          "ONLY_IN_CARNET": [],
          "CONFLICTS": [],
          "note": "CarNet's dataset does not store this attribute; every verified value is new information."
        },
        "transmission_gears": {
          "carnet_stores_field": false,
          "CURRENT_CARNET": [],
          "NEW_VERIFIED": [
            8
          ],
          "NEW_PROVISIONAL_ONLY": [
            6
          ],
          "NEW_NEEDS_SOURCE_RETRIEVAL": [],
          "MATCHED": [],
          "MISSING_FROM_CARNET": [
            8
          ],
          "PROVISIONAL_NOT_IN_CARNET": [
            6
          ],
          "NEEDS_SOURCE_RETRIEVAL_NOT_IN_CARNET": [],
          "CARNET_VALUE_ONLY_PROVISIONAL": [],
          "CARNET_VALUE_ONLY_NEEDS_SOURCE_RETRIEVAL": [],
          "ONLY_IN_CARNET": [],
          "CONFLICTS": [
            {
              "conflict_id": "CF-toyota-gr_corolla-003",
              "field": "transmission_gears",
              "engine_group": "model_level",
              "severity": "definite",
              "values": [
                [
                  "GRC-004",
                  6
                ],
                [
                  "GRC-005",
                  8
                ]
              ]
            },
            {
              "conflict_id": "CF-toyota-gr_corolla-004",
              "field": "transmission_gears",
              "engine_group": "model_level",
              "severity": "definite",
              "values": [
                [
                  "GRC-016",
                  6
                ],
                [
                  "GRC-017",
                  8
                ]
              ]
            }
          ],
          "note": "CarNet's dataset does not store this attribute; every verified value is new information."
        },
        "drivetrains": {
          "carnet_stores_field": true,
          "CURRENT_CARNET": [],
          "NEW_VERIFIED": [
            "AWD"
          ],
          "NEW_PROVISIONAL_ONLY": [],
          "NEW_NEEDS_SOURCE_RETRIEVAL": [],
          "MATCHED": [],
          "MISSING_FROM_CARNET": [
            "AWD"
          ],
          "PROVISIONAL_NOT_IN_CARNET": [],
          "NEEDS_SOURCE_RETRIEVAL_NOT_IN_CARNET": [],
          "CARNET_VALUE_ONLY_PROVISIONAL": [],
          "CARNET_VALUE_ONLY_NEEDS_SOURCE_RETRIEVAL": [],
          "ONLY_IN_CARNET": [],
          "CONFLICTS": [],
          "legacy_view": {
            "reason": "legacy dataset and Sell/Search pickers have no 4WD value; every 4x4 is stored as AWD",
            "mapping": {
              "4WD": "AWD"
            },
            "MISSING_FROM_CARNET": [
              "AWD"
            ]